[
  {
    "id": "tts-dls-001",
    "class": "default_language_selector",
    "selector": {
      "active_adapter": "codex",
      "explicit_user_language": "en",
      "declared_adapter_default": "pt-BR",
      "codex_default": "pt-BR",
      "claude_default": "pt-BR",
      "request_language": "pt-BR",
      "dominant_text_language": "pt-BR"
    },
    "source_text": "Leia este texto em English: vamos revisar a ADR.",
    "expected_target_language": "en",
    "protected_terms": [
      {
        "term": "ADR",
        "kind": "acronym",
        "must_preserve": true,
        "pronunciation_hint_expected": true
      }
    ],
    "redaction": {
      "contains_secret_like_value": false,
      "expected_redactions": []
    },
    "provider_state": "normalization_degraded",
    "expected_status": "PASS",
    "no_summary": true,
    "notes": "DLS-001: explicit user language wins over declared adapter default."
  },
  {
    "id": "tts-dls-002",
    "class": "default_language_selector",
    "selector": {
      "active_adapter": "codex",
      "explicit_user_language": "absent",
      "declared_adapter_default": "pt-BR",
      "codex_default": "pt-BR",
      "claude_default": "pt-BR",
      "request_language": "en",
      "dominant_text_language": "en"
    },
    "source_text": "Read the MCP note aloud with the adapter default.",
    "expected_target_language": "pt-BR",
    "protected_terms": [
      {
        "term": "MCP",
        "kind": "acronym",
        "must_preserve": true,
        "pronunciation_hint_expected": true
      }
    ],
    "redaction": {
      "contains_secret_like_value": false,
      "expected_redactions": []
    },
    "provider_state": "normalization_degraded",
    "expected_status": "PASS",
    "no_summary": true,
    "notes": "DLS-002: declared adapter default wins when no user language is explicit."
  },
  {
    "id": "tts-dls-003",
    "class": "default_language_selector",
    "selector": {
      "active_adapter": "unknown",
      "explicit_user_language": "absent",
      "declared_adapter_default": "unknown",
      "codex_default": "unknown",
      "claude_default": "unknown",
      "request_language": "pt-BR",
      "dominant_text_language": "en"
    },
    "source_text": "Pode narrar: the SPEC should stay precise.",
    "expected_target_language": "pt-BR",
    "protected_terms": [
      {
        "term": "SPEC",
        "kind": "technical_term",
        "must_preserve": true,
        "pronunciation_hint_expected": true
      }
    ],
    "redaction": {
      "contains_secret_like_value": false,
      "expected_redactions": []
    },
    "provider_state": "normalization_degraded",
    "expected_status": "PASS",
    "no_summary": true,
    "notes": "DLS-003: request language wins when adapter default is unknown."
  },
  {
    "id": "tts-dls-004",
    "class": "default_language_selector",
    "selector": {
      "active_adapter": "unknown",
      "explicit_user_language": "absent",
      "declared_adapter_default": "unknown",
      "codex_default": "unknown",
      "claude_default": "unknown",
      "request_language": "unclear",
      "dominant_text_language": "de"
    },
    "source_text": "Bitte lies den API-Hinweis vor.",
    "expected_target_language": "de",
    "protected_terms": [
      {
        "term": "API",
        "kind": "acronym",
        "must_preserve": true,
        "pronunciation_hint_expected": true
      }
    ],
    "redaction": {
      "contains_secret_like_value": false,
      "expected_redactions": []
    },
    "provider_state": "normalization_degraded",
    "expected_status": "PASS",
    "no_summary": true,
    "notes": "DLS-004: dominant text language wins when request language is unclear."
  },
  {
    "id": "tts-dls-005",
    "class": "default_language_selector",
    "selector": {
      "active_adapter": "unknown",
      "explicit_user_language": "absent",
      "declared_adapter_default": "unknown",
      "codex_default": "unknown",
      "claude_default": "unknown",
      "request_language": "unclear",
      "dominant_text_language": "unclear"
    },
    "source_text": "ADR / SPEC / MCP",
    "expected_target_language": "preserve_original",
    "protected_terms": [
      {
        "term": "ADR",
        "kind": "acronym",
        "must_preserve": true,
        "pronunciation_hint_expected": true
      },
      {
        "term": "SPEC",
        "kind": "technical_term",
        "must_preserve": true,
        "pronunciation_hint_expected": true
      },
      {
        "term": "MCP",
        "kind": "acronym",
        "must_preserve": true,
        "pronunciation_hint_expected": true
      }
    ],
    "redaction": {
      "contains_secret_like_value": false,
      "expected_redactions": []
    },
    "provider_state": "normalization_degraded",
    "expected_status": "PASS",
    "no_summary": true,
    "notes": "DLS-005: unclear inputs preserve original language instead of guessing."
  },
  {
    "id": "tts-dls-006",
    "class": "default_language_selector",
    "selector": {
      "active_adapter": "cursor",
      "explicit_user_language": "absent",
      "declared_adapter_default": "unknown",
      "codex_default": "pt-BR",
      "claude_default": "pt-BR",
      "request_language": "en",
      "dominant_text_language": "en"
    },
    "source_text": "Read the SDK note aloud from Cursor when no Cursor language rule exists.",
    "expected_target_language": "pt-BR",
    "protected_terms": [
      {
        "term": "SDK",
        "kind": "acronym",
        "must_preserve": true,
        "pronunciation_hint_expected": true
      }
    ],
    "redaction": {
      "contains_secret_like_value": false,
      "expected_redactions": []
    },
    "provider_state": "normalization_degraded",
    "expected_status": "PASS",
    "no_summary": true,
    "notes": "DLS-006: Cursor without a native structured default falls back to Codex default first, then Claude default."
  },
  {
    "id": "tts-lang-pt-br",
    "class": "language_normalization",
    "selector": {
      "active_adapter": "codex",
      "explicit_user_language": "absent",
      "declared_adapter_default": "pt-BR",
      "codex_default": "pt-BR",
      "claude_default": "pt-BR",
      "request_language": "pt-BR",
      "dominant_text_language": "pt-BR"
    },
    "source_text": "Leia a SPEC em voz alta sem resumir o texto original.",
    "expected_target_language": "pt-BR",
    "protected_terms": [
      {
        "term": "SPEC",
        "kind": "technical_term",
        "must_preserve": true,
        "pronunciation_hint_expected": true
      }
    ],
    "redaction": {
      "contains_secret_like_value": false,
      "expected_redactions": []
    },
    "provider_state": "normalization_degraded",
    "expected_status": "PASS",
    "no_summary": true,
    "notes": "Single-language pt-BR fixture."
  },
  {
    "id": "tts-lang-en",
    "class": "language_normalization",
    "selector": {
      "active_adapter": "codex",
      "explicit_user_language": "en",
      "declared_adapter_default": "pt-BR",
      "codex_default": "pt-BR",
      "claude_default": "pt-BR",
      "request_language": "en",
      "dominant_text_language": "en"
    },
    "source_text": "Read this ADR aloud and preserve MCP as a technical term.",
    "expected_target_language": "en",
    "protected_terms": [
      {
        "term": "ADR",
        "kind": "acronym",
        "must_preserve": true,
        "pronunciation_hint_expected": true
      },
      {
        "term": "MCP",
        "kind": "acronym",
        "must_preserve": true,
        "pronunciation_hint_expected": true
      }
    ],
    "redaction": {
      "contains_secret_like_value": false,
      "expected_redactions": []
    },
    "provider_state": "normalization_degraded",
    "expected_status": "PASS",
    "no_summary": true,
    "notes": "Single-language English fixture."
  },
  {
    "id": "tts-lang-es",
    "class": "language_normalization",
    "selector": {
      "active_adapter": "unknown",
      "explicit_user_language": "absent",
      "declared_adapter_default": "unknown",
      "codex_default": "unknown",
      "claude_default": "unknown",
      "request_language": "es",
      "dominant_text_language": "es"
    },
    "source_text": "Lee este resumen de API en voz alta sin cambiar JSON.",
    "expected_target_language": "es",
    "protected_terms": [
      {
        "term": "API",
        "kind": "acronym",
        "must_preserve": true,
        "pronunciation_hint_expected": true
      },
      {
        "term": "JSON",
        "kind": "technical_term",
        "must_preserve": true,
        "pronunciation_hint_expected": true
      }
    ],
    "redaction": {
      "contains_secret_like_value": false,
      "expected_redactions": []
    },
    "provider_state": "normalization_degraded",
    "expected_status": "PASS",
    "no_summary": true,
    "notes": "Single-language Spanish fixture."
  },
  {
    "id": "tts-lang-fr",
    "class": "language_normalization",
    "selector": {
      "active_adapter": "unknown",
      "explicit_user_language": "absent",
      "declared_adapter_default": "unknown",
      "codex_default": "unknown",
      "claude_default": "unknown",
      "request_language": "fr",
      "dominant_text_language": "fr"
    },
    "source_text": "Lis cette note CLI a voix haute et garde YAML intact.",
    "expected_target_language": "fr",
    "protected_terms": [
      {
        "term": "CLI",
        "kind": "acronym",
        "must_preserve": true,
        "pronunciation_hint_expected": true
      },
      {
        "term": "YAML",
        "kind": "technical_term",
        "must_preserve": true,
        "pronunciation_hint_expected": true
      }
    ],
    "redaction": {
      "contains_secret_like_value": false,
      "expected_redactions": []
    },
    "provider_state": "normalization_degraded",
    "expected_status": "PASS",
    "no_summary": true,
    "notes": "Single-language French fixture."
  },
  {
    "id": "tts-lang-it",